{
  "$schema": "./medications.schema.json",
  "version": 1,
  "pkProfiles": [
    {
      "id": "semaglutide-injection",
      "name": "Semaglutide injection",
      "pk": {
        "halfLifeHours": 168,
        "tmaxHours": 56,
        "notes": "Label: half-life about 1 week, peak 1 to 3 days after a dose, bioavailability 89% under the skin. The model uses the single-dose median time to peak of 56 h in healthy adults.",
        "sources": [
          {
            "kind": "label",
            "citation": "WEGOVY (semaglutide) US prescribing information, section 12.3",
            "url": "https://dailymed.nlm.nih.gov/dailymed/drugInfo.cfm?setid=ee06186f-2aa3-4990-a760-757579d8f77b"
          },
          {
            "kind": "trial",
            "citation": "Clinical Pharmacokinetics of Semaglutide: A Systematic Review (2024)",
            "url": "https://pmc.ncbi.nlm.nih.gov/articles/PMC11215664/"
          }
        ]
      }
    },
    {
      "id": "semaglutide-tablet",
      "name": "Semaglutide tablet",
      "pk": null,
      "pkUnavailableReason": "Only about 0.4% to 2% of a semaglutide tablet is absorbed (prescribing label), and the share changes from day to day with how it is taken. An estimate built from the tablet strength would overstate the amount in the body many times over, so Tidebook does not draw one."
    },
    {
      "id": "tirzepatide-injection",
      "name": "Tirzepatide injection",
      "pk": {
        "halfLifeHours": 120,
        "tmaxHours": 24,
        "notes": "Label: half-life about 5 days (5 to 6 days in people with overweight or obesity), median time to peak 24 hours (range 8 to 72), bioavailability 80%.",
        "sources": [
          {
            "kind": "label",
            "citation": "ZEPBOUND (tirzepatide) US prescribing information, section 12.3",
            "url": "https://dailymed.nlm.nih.gov/dailymed/drugInfo.cfm?setid=487cd7e7-434c-4925-99fa-aa80b1cc776b"
          },
          {
            "kind": "label",
            "citation": "MOUNJARO (tirzepatide) US prescribing information, section 12.3",
            "url": "https://dailymed.nlm.nih.gov/dailymed/drugInfo.cfm?setid=d2d7da5d-ad07-4228-955f-cf7e355c8cc0"
          }
        ]
      }
    },
    {
      "id": "orforglipron-tablet",
      "name": "Orforglipron tablet",
      "pk": {
        "halfLifeHours": 39,
        "tmaxHours": 6,
        "notes": "Label: half-life about 29 to 49 hours, peak 4 to 8 hours after a dose, bioavailability 77%. The label gives ranges; the model uses the middle of each.",
        "sources": [
          {
            "kind": "label",
            "citation": "FOUNDAYO (orforglipron) US prescribing information, section 12.3",
            "url": "https://dailymed.nlm.nih.gov/dailymed/drugInfo.cfm?setid=8ac446c5-feba-474f-a103-23facb9b5c62"
          },
          {
            "kind": "model",
            "citation": "Half-life and time to peak set at the middle of the label ranges"
          }
        ]
      }
    }
  ],
  "products": [
    {
      "id": "ozempic",
      "name": "Ozempic",
      "kind": "brand",
      "molecule": "semaglutide",
      "route": "injection",
      "maker": "Novo Nordisk",
      "intervalDays": 7,
      "strengths": {
        "values": [0.25, 0.5, 1, 2],
        "source": {
          "kind": "label",
          "citation": "OZEMPIC (semaglutide) injection US prescribing information, sections 2 and 3",
          "url": "https://dailymed.nlm.nih.gov/dailymed/drugInfo.cfm?setid=adec4fd2-6858-4c99-91d4-531f5f2a2d79"
        }
      },
      "titration": {
        "unit": "week",
        "steps": [
          {
            "from": 1,
            "doseMg": 0.25
          },
          {
            "from": 5,
            "doseMg": 0.5
          }
        ],
        "maintenance": "0.5 mg, 1 mg or 2 mg once weekly, each step after at least 4 weeks on the current dose.",
        "source": {
          "kind": "label",
          "citation": "OZEMPIC (semaglutide) injection US prescribing information, section 2",
          "url": "https://dailymed.nlm.nih.gov/dailymed/drugInfo.cfm?setid=adec4fd2-6858-4c99-91d4-531f5f2a2d79"
        }
      },
      "pkProfile": "semaglutide-injection",
      "trialIds": ["sustain-1", "sustain-forte", "surpass-2", "step-2"],
      "note": "Approved for type 2 diabetes. Its weight results come from diabetes trials."
    },
    {
      "id": "wegovy",
      "name": "Wegovy",
      "kind": "brand",
      "molecule": "semaglutide",
      "route": "injection",
      "maker": "Novo Nordisk",
      "intervalDays": 7,
      "strengths": {
        "values": [0.25, 0.5, 1, 1.7, 2.4, 7.2],
        "source": {
          "kind": "label",
          "citation": "WEGOVY (semaglutide) US prescribing information, section 3",
          "url": "https://dailymed.nlm.nih.gov/dailymed/drugInfo.cfm?setid=ee06186f-2aa3-4990-a760-757579d8f77b"
        }
      },
      "titration": {
        "unit": "week",
        "steps": [
          {
            "from": 1,
            "doseMg": 0.25
          },
          {
            "from": 5,
            "doseMg": 0.5
          },
          {
            "from": 9,
            "doseMg": 1
          },
          {
            "from": 13,
            "doseMg": 1.7
          },
          {
            "from": 17,
            "doseMg": 2.4
          }
        ],
        "maintenance": "2.4 mg once weekly, or 1.7 mg; 7.2 mg (WEGOVY HD) for some adults.",
        "source": {
          "kind": "label",
          "citation": "WEGOVY (semaglutide) US prescribing information, section 2",
          "url": "https://dailymed.nlm.nih.gov/dailymed/drugInfo.cfm?setid=ee06186f-2aa3-4990-a760-757579d8f77b"
        }
      },
      "pkProfile": "semaglutide-injection",
      "trialIds": ["step-1", "step-up", "step-3", "step-2", "step-up-t2d"],
      "note": "Approved for chronic weight management."
    },
    {
      "id": "mounjaro",
      "name": "Mounjaro",
      "kind": "brand",
      "molecule": "tirzepatide",
      "route": "injection",
      "maker": "Eli Lilly",
      "intervalDays": 7,
      "strengths": {
        "values": [2.5, 5, 7.5, 10, 12.5, 15],
        "source": {
          "kind": "label",
          "citation": "MOUNJARO (tirzepatide) US prescribing information, section 3",
          "url": "https://dailymed.nlm.nih.gov/dailymed/drugInfo.cfm?setid=d2d7da5d-ad07-4228-955f-cf7e355c8cc0"
        }
      },
      "titration": {
        "unit": "week",
        "steps": [
          {
            "from": 1,
            "doseMg": 2.5
          },
          {
            "from": 5,
            "doseMg": 5
          }
        ],
        "maintenance": "Increases of 2.5 mg after at least 4 weeks on the current dose, up to 15 mg once weekly.",
        "source": {
          "kind": "label",
          "citation": "MOUNJARO (tirzepatide) US prescribing information, section 2",
          "url": "https://dailymed.nlm.nih.gov/dailymed/drugInfo.cfm?setid=d2d7da5d-ad07-4228-955f-cf7e355c8cc0"
        }
      },
      "pkProfile": "tirzepatide-injection",
      "trialIds": ["surpass-1", "surpass-2", "surmount-2"],
      "note": "Approved for type 2 diabetes. Its weight results come from diabetes trials."
    },
    {
      "id": "zepbound",
      "name": "Zepbound",
      "kind": "brand",
      "molecule": "tirzepatide",
      "route": "injection",
      "maker": "Eli Lilly",
      "intervalDays": 7,
      "strengths": {
        "values": [2.5, 5, 7.5, 10, 12.5, 15],
        "source": {
          "kind": "label",
          "citation": "ZEPBOUND (tirzepatide) US prescribing information, section 3",
          "url": "https://dailymed.nlm.nih.gov/dailymed/drugInfo.cfm?setid=487cd7e7-434c-4925-99fa-aa80b1cc776b"
        }
      },
      "titration": {
        "unit": "week",
        "steps": [
          {
            "from": 1,
            "doseMg": 2.5
          },
          {
            "from": 5,
            "doseMg": 5
          }
        ],
        "maintenance": "5 mg, 10 mg or 15 mg once weekly, raised in 2.5 mg steps after at least 4 weeks on the current dose.",
        "source": {
          "kind": "label",
          "citation": "ZEPBOUND (tirzepatide) US prescribing information, section 2",
          "url": "https://dailymed.nlm.nih.gov/dailymed/drugInfo.cfm?setid=487cd7e7-434c-4925-99fa-aa80b1cc776b"
        }
      },
      "pkProfile": "tirzepatide-injection",
      "trialIds": ["surmount-1", "surmount-2"],
      "note": "Approved for chronic weight management and obstructive sleep apnea."
    },
    {
      "id": "wegovy-tablet",
      "name": "Wegovy tablets",
      "kind": "brand",
      "molecule": "semaglutide",
      "route": "tablet",
      "maker": "Novo Nordisk",
      "intervalDays": 1,
      "strengths": {
        "values": [1.5, 4, 9, 25],
        "source": {
          "kind": "label",
          "citation": "WEGOVY (semaglutide) US prescribing information, section 3",
          "url": "https://dailymed.nlm.nih.gov/dailymed/drugInfo.cfm?setid=ee06186f-2aa3-4990-a760-757579d8f77b"
        }
      },
      "titration": {
        "unit": "day",
        "steps": [
          {
            "from": 1,
            "doseMg": 1.5
          },
          {
            "from": 31,
            "doseMg": 4
          },
          {
            "from": 61,
            "doseMg": 9
          },
          {
            "from": 91,
            "doseMg": 25
          }
        ],
        "maintenance": "25 mg once daily.",
        "source": {
          "kind": "label",
          "citation": "WEGOVY (semaglutide) US prescribing information, section 2",
          "url": "https://dailymed.nlm.nih.gov/dailymed/drugInfo.cfm?setid=ee06186f-2aa3-4990-a760-757579d8f77b"
        }
      },
      "pkProfile": "semaglutide-tablet",
      "trialIds": ["oasis-4"],
      "note": "Approved for chronic weight management. Taken daily on an empty stomach."
    },
    {
      "id": "foundayo",
      "name": "Foundayo",
      "kind": "brand",